{
  "id": "session-mornqar-ledger",
  "campaignId": "project-3",
  "sequence": 3,
  "status": "active",
  "headline": "Mornqar's Ledger",
  "summary": "The active session is tracking a broker carrying the scarf ledger into the market.",
  "expectedDirection": "Push the market broker until the bank trail becomes unavoidable.",
  "placeIds": ["place-grand-archive", "place-skybridge-market"],
  "notes": "Keep the broker visible and the archive pressure close behind so the table feels the squeeze.",
  "startedAt": "2026-04-06T18:30:00.000Z",
  "endedAt": null,
  "updatedAt": "2026-04-06T18:30:00.000Z"
}
